{
    "$schema": "http://json-schema.org/draft-04/schema#",
    "title": "POST /v1/workflows",

    "type": "object",
    "properties": {
        "inputs": { "$ref": "#/definitions/inputDictionary" },
        "tasks": { "$ref": "#/definitions/taskDictionary" },
        "edges": { "type": "array" },
        "parallelBy": { "$ref": "#/definitions/name" }
    },
    "required": ["inputs", "tasks", "edges"],
    "additionalProperties": false,

    "definitions": {
        "name": {
            "type": "string",
            "minLength": 1
        },

        "inputType": { "oneOf": [
            { "$ref": "#/definitions/name" },
            {
                "type": "array",
                "items": { "$ref": "#/definitions/inputType" }
            }
        ]},

        "inputDictionary": {
            "type": "object",
            "patternProperties": {
                "^.+$": { "$ref": "#/definitions/inputType" }
            },
            "additionalProperties": false
        },

        "taskDictionary": {
            "type": "object",
            "patternProperties": {
                "^.+$": { "$ref": "#/definitions/task" }
            },
            "additionalProperties": false
        },

        "task": {
            "type": "object",
            "properties": {
                "methods": { "type": "array" },
                "parallelBy": { "$ref": "#/definitions/name" }
            },
            "additionalProperties": false
        }
    }
}
